{"activation":"external-host-only","agent":{"bytes":430291,"executable":false,"media_type":"text/x-python","particle":{"hash":"bc4ab23d8247bb4c1d5a56db7c07d31fdc925132416820e847aa48049fd5ed11","space":"rapp/1:particle"},"path":"artifacts/sha256/827f637c024e3fa1229148e5dcd78230a84ea3214283f899d22603741350f23c/agent.py","role":"generic-autobest-agent","sha256":"827f637c024e3fa1229148e5dcd78230a84ea3214283f899d22603741350f23c"},"authority_from_presence":false,"capability_id":"autobest:generic","grants_authority":false,"invoker":"external-global-brainstem","mutation":"successor-only","profiles":["generic","microsol-ceo"],"rapp1_role":"core-compatibility-substrate","schema":"rapp-work-compatibility/1/capability-manifest","skill":{"bytes":39139,"executable":false,"media_type":"text/markdown","particle":{"hash":"c624dc789953624bdecc2e17b7102116f06c95ae01915a65dfb32279287e8491","space":"rapp/1:particle"},"path":"artifacts/sha256/5f8bd5b3c48858329f87ae3812dbc30ee604cb664985dc3d42a79e69d8bdfda8/SKILL.md","role":"generic-autobest-skill","sha256":"5f8bd5b3c48858329f87ae3812dbc30ee604cb664985dc3d42a79e69d8bdfda8"},"skill_activates":false,"tile_schema":"rapp-work-capability-tile/1","tile_subject":"exact-agent.py-bytes","version":1}